{
  "schema_version": "1.0.0",
  "fingerprint_id": "fp_1a2b3c4d5e6f7a8b",
  "task_family": "swe_bench_verified",
  "workflow_phase": "EXECUTION",
  "language": "python",
  "framework": "pytest",
  "ast_depth": 6,
  "cyclomatic_complexity": 8,
  "context_token_weight": 600,
  "required_tools": [
    "read_file",
    "replace_file_content",
    "run_pytest"
  ],
  "risk_class": "MEDIUM",
  "latency_sensitivity": "INTERACTIVE",
  "feature_vector_hash": "b1b1b1b1b1b1b1b1b1b1b1b1b1b1b1b1b1b1b1b1b1b1b1b1b1b1b1b1b1b1b1b1",
  "created_at": "2026-08-29T10:00:10.000Z"
}
